{
  "event_id": "01a0c3a5-e3e0-70ce-b5a1-ded9f0588019",
  "schema_version": 1,
  "command_type": "PASSWORD_RESET_REQUESTED",
  "occurred_at": "2026-09-21T10:05:00Z",
  "dedupe_key": "password-reset:01a0c3a5-e3e0-70ce-b5a1-ded9f0588018:token-id",
  "user_id": "01a0c3a5-e3e0-70ce-b5a1-ded9f0588018",
  "channel": "EMAIL",
  "recipient": "user@example.com",
  "template": "auth-password-reset-v1",
  "data": {
    "display_name": "Smoke Test User",
    "reset_url": "https://taca.vn/reset-password?token=opaque-token",
    "expires_in_minutes": 30
  }
}